{"manifest_version":"run/v1","status":"complete","run_id":"r1","created_at":"1970-01-01T00:00:00Z","snapshot_id":"aaaaaaaaaaaaaaaaaaaaaaaaaaaaaaaaaaaaaaaaaaaaaaaaaaaaaaaaaaaaaaaa","strategy_id":"strategy","engine_version":"0.1.0","config_hash":"bbbbbbbbbbbbbbbbbbbbbbbbbbbbbbbbbbbbbbbbbbbbbbbbbbbbbbbbbbbbbbbb","artifact_schema_id":"trademaster.run-artifacts/v1","artifact_schema_sha256":"cac0260af5b35e7bcedaa2f1885a41485fb4ce46426af78bef675a6a33190b03","artifacts":[{"artifact_name":"accepted_orders","uri":"accepted_orders.parquet","sha256":"cccccccccccccccccccccccccccccccccccccccccccccccccccccccccccccccc","row_count":0},{"artifact_name":"account_states","uri":"account_states.parquet","sha256":"cccccccccccccccccccccccccccccccccccccccccccccccccccccccccccccccc","row_count":0},{"artifact_name":"expiries","uri":"expiries.parquet","sha256":"cccccccccccccccccccccccccccccccccccccccccccccccccccccccccccccccc","row_count":0},{"artifact_name":"fills","uri":"fills.parquet","sha256":"cccccccccccccccccccccccccccccccccccccccccccccccccccccccccccccccc","row_count":0},{"artifact_name":"ledger_postings","uri":"ledger_postings.parquet","sha256":"cccccccccccccccccccccccccccccccccccccccccccccccccccccccccccccccc","row_count":0},{"artifact_name":"nav","uri":"nav.parquet","sha256":"cccccccccccccccccccccccccccccccccccccccccccccccccccccccccccccccc","row_count":0},{"artifact_name":"orders","uri":"orders.parquet","sha256":"cccccccccccccccccccccccccccccccccccccccccccccccccccccccccccccccc","row_count":0},{"artifact_name":"position_lots","uri":"position_lots.parquet","sha256":"cccccccccccccccccccccccccccccccccccccccccccccccccccccccccccccccc","row_count":0},{"artifact_name":"positions","uri":"positions.parquet","sha256":"cccccccccccccccccccccccccccccccccccccccccccccccccccccccccccccccc","row_count":0},{"artifact_name":"rejections","uri":"rejections.parquet","sha256":"cccccccccccccccccccccccccccccccccccccccccccccccccccccccccccccccc","row_count":0},{"artifact_name":"signals","uri":"signals.parquet","sha256":"cccccccccccccccccccccccccccccccccccccccccccccccccccccccccccccccc","row_count":0}]}
